{
    "task_id": "TASK-0001",
    "work_item_revision": 1,
    "artifact_attempt": 1,
    "subject_base_commit": "3c86b5335d531b662e127bb5da6d8b442bf75af0",
    "subject_head_commit": "7e10dae772c07c03c29ea122d4e80a1e18d31262",
    "subject_diff_hash": "f8da6ed86a18043f59f80383eefe6a376b14103658d1f1afa1e0aa4e8b52237a",
    "validated_at": "2026-08-13T14:49:44.7026447Z",
    "verdict": "PASS",
    "acceptance_results": [
        {
            "acceptance_id": "AC-01",
            "command_or_check": "Check first-time setup, .agents/skills, tools/polaris, .polaris, and Git tracking instructions in docs/USAGE.md",
            "cwd": "E:/work/engineering_mgr/Polaris",
            "environment_summary": "Windows PowerShell; Python 3.11.15; Git 2.41.0.windows.3",
            "started_at": "2026-08-13T14:49:31.8330480Z",
            "exit_code": 0,
            "result": "PASS",
            "output_path_or_hash": "sha256:ab2b9cb7a40f6f4a8364165fd9b16019816e86158aaed871f2e02f0dd25567d7"
        },
        {
            "acceptance_id": "AC-02",
            "command_or_check": "Check pre-request sync, recognizable worktree, repository root, and Skill discovery instructions",
            "cwd": "E:/work/engineering_mgr/Polaris",
            "environment_summary": "Windows PowerShell; Python 3.11.15; Git 2.41.0.windows.3",
            "started_at": "2026-08-13T14:49:31.8330480Z",
            "exit_code": 0,
            "result": "PASS",
            "output_path_or_hash": "sha256:ab2b9cb7a40f6f4a8364165fd9b16019816e86158aaed871f2e02f0dd25567d7"
        },
        {
            "acceptance_id": "AC-03",
            "command_or_check": "Check request template, complete pagination example, and Human-owned decision guidance",
            "cwd": "E:/work/engineering_mgr/Polaris",
            "environment_summary": "Windows PowerShell; Python 3.11.15; Git 2.41.0.windows.3",
            "started_at": "2026-08-13T14:49:31.8330480Z",
            "exit_code": 0,
            "result": "PASS",
            "output_path_or_hash": "sha256:ab2b9cb7a40f6f4a8364165fd9b16019816e86158aaed871f2e02f0dd25567d7"
        },
        {
            "acceptance_id": "AC-04",
            "command_or_check": "Check R0/R1/R2, lifecycle, user gates, and no direct state editing guidance",
            "cwd": "E:/work/engineering_mgr/Polaris",
            "environment_summary": "Windows PowerShell; Python 3.11.15; Git 2.41.0.windows.3",
            "started_at": "2026-08-13T14:49:31.8330480Z",
            "exit_code": 0,
            "result": "PASS",
            "output_path_or_hash": "sha256:ab2b9cb7a40f6f4a8364165fd9b16019816e86158aaed871f2e02f0dd25567d7"
        },
        {
            "acceptance_id": "AC-05",
            "command_or_check": "Check R1/R2 fresh Review session, handoff, and third-rejection BLOCKED behavior",
            "cwd": "E:/work/engineering_mgr/Polaris",
            "environment_summary": "Windows PowerShell; Python 3.11.15; Git 2.41.0.windows.3",
            "started_at": "2026-08-13T14:49:31.8330480Z",
            "exit_code": 0,
            "result": "PASS",
            "output_path_or_hash": "sha256:ab2b9cb7a40f6f4a8364165fd9b16019816e86158aaed871f2e02f0dd25567d7"
        },
        {
            "acceptance_id": "AC-06",
            "command_or_check": "Check same-computer and fresh-clone recovery commands and unrecoverable-state boundary",
            "cwd": "E:/work/engineering_mgr/Polaris",
            "environment_summary": "Windows PowerShell; Python 3.11.15; Git 2.41.0.windows.3",
            "started_at": "2026-08-13T14:49:31.8330480Z",
            "exit_code": 0,
            "result": "PASS",
            "output_path_or_hash": "sha256:ab2b9cb7a40f6f4a8364165fd9b16019816e86158aaed871f2e02f0dd25567d7"
        },
        {
            "acceptance_id": "AC-07",
            "command_or_check": "Check README link and referenced paths; run git diff --check and python tests/run_tests.py",
            "cwd": "E:/work/engineering_mgr/Polaris",
            "environment_summary": "Windows PowerShell; Python 3.11.15; Git 2.41.0.windows.3",
            "started_at": "2026-08-13T14:48:04.0792399Z",
            "exit_code": 0,
            "result": "PASS",
            "output_path_or_hash": "static-sha256:ab2b9cb7a40f6f4a8364165fd9b16019816e86158aaed871f2e02f0dd25567d7; tests-sha256:44f028fd2e066284bfdc8e3802bff8e25d0d6d6baaf0a939af502f9fc7216cae; tests:22/22"
        }
    ]
}
